[
  {
    "entity_code": "ne-abc12",
    "display_name": "López Gutiérrez, Juan",
    "entity_type": "person",
    "sort_name": "López Gutiérrez, Juan",
    "given_name": "Juan",
    "surname": "López Gutiérrez",
    "dates_of_existence": "ca. 1750–1812",
    "primary_function": "Escribano público"
  }
]
